{
  "$schema": "http://json-schema.org/draft-07/schema#",
  "$ref": "#/definitions/NetworkConfig",
  "definitions": {
    "NetworkConfig": {
      "type": "object",
      "properties": {
        "osmo-test-4": {
          "$ref": "#/definitions/Network"
        },
        "osmosis-1": {
          "$ref": "#/definitions/Network"
        },
        "pulsar-2": {
          "$ref": "#/definitions/Network"
        },
        "injective-888": {
          "$ref": "#/definitions/Network"
        },
        "injective-1": {
          "$ref": "#/definitions/Network"
        }
      },
      "required": [
        "osmo-test-4",
        "osmosis-1",
        "pulsar-2",
        "injective-888",
        "injective-1"
      ],
      "additionalProperties": false
    },
    "Network": {
      "type": "object",
      "properties": {
        "name": {
          "type": "string"
        },
        "chain_id": {
          "$ref": "#/definitions/SupportedNetwork"
        },
        "supported_wallets": {
          "type": "array",
          "items": {
            "$ref": "#/definitions/Wallet"
          }
        },
        "supported_apps": {
          "type": "array",
          "items": {
            "$ref": "#/definitions/App"
          }
        },
        "code_ids": {
          "type": "array",
          "items": {
            "$ref": "#/definitions/CodeID"
          }
        },
        "contracts": {
          "type": "array",
          "items": {
            "$ref": "#/definitions/Contract"
          }
        }
      },
      "required": [
        "name",
        "chain_id",
        "supported_wallets",
        "supported_apps",
        "code_ids",
        "contracts"
      ],
      "additionalProperties": false
    },
    "SupportedNetwork": {
      "type": "string",
      "enum": [
        "osmo-test-4",
        "osmosis-1",
        "pulsar-2",
        "injective-888",
        "injective-1"
      ]
    },
    "Wallet": {
      "type": "object",
      "properties": {
        "name": {
          "type": "string"
        },
        "config": {}
      },
      "required": [
        "name"
      ],
      "additionalProperties": false
    },
    "App": {
      "type": "object",
      "properties": {
        "name": {
          "type": "string"
        },
        "supportedFeatures": {
          "type": "array",
          "items": {
            "type": "string"
          }
        }
      },
      "required": [
        "name",
        "supportedFeatures"
      ],
      "additionalProperties": false
    },
    "CodeID": {
      "type": "object",
      "properties": {
        "label": {
          "type": "string"
        },
        "id": {
          "type": "number"
        },
        "checksum": {
          "type": "string"
        }
      },
      "required": [
        "label",
        "id",
        "checksum"
      ],
      "additionalProperties": false
    },
    "Contract": {
      "type": "object",
      "properties": {
        "label": {
          "type": "string"
        },
        "code_id": {
          "type": "number"
        },
        "address": {
          "type": "string"
        },
        "description": {
          "type": "string"
        },
        "admin": {
          "type": [
            "string",
            "boolean"
          ]
        }
      },
      "required": [
        "label",
        "address"
      ],
      "additionalProperties": false
    }
  }
}